tmp_fix_full/simulation-of-arbitrage-free-implied-volatility-surfaces/assets/table_011.csv

118,R. CONT AND M. VULETIĆ,,,
Table 7. Arbitrage presence in scenarios from the SPX factor model (30)–(31).,,,,
,Total,Calendar,Call,Butterfuly
Paths,62.761%,21.245%,36.548%,36.548%
Surfaces,16.055%,4.004%,9.117%,7.073%

tmp_fix_full2/simulation-of-arbitrage-free-implied-volatility-surfaces/paper.md

### Applied Mathematical Finance

118
Table 7. Arbitrage presence in scenarios from the SPX factor model (30)–(31).
Total
Calendar
Call
Butterfuly
Paths
62.761%
21.245%
36.548%
36.548%
Surfaces
16.055%
4.004%
9.117%
7.073%
Table 8. Quantiles of arbitrage penalty under PN
β for SPX factor model (30)–(31).
102
104
106
1010
1015
β
0
5 · 10−5
5 · 10−10
2 · 10−13
90th quantile
0.20
0
0
2 · 10−7
3 · 10−9
4 · 10−15
0
95th quantile
0.77
0.002
3 · 10−7
2 · 10−9
1 · 10−11
4 · 10−16
99th quantile
4.49
0.01
Figure 19. Simulation of a 10-year scenario for VIX (red) and SPX (blue) using the SPX factor
model (31)–(33).
Simulating the volatility index We simulate the VIX dynamics associated with the SPX
four-factor model (30)–(33) using the methodology from CBOE (2022). We fix the moneyness grid by taking 100 equispaced values between 0.5 and 1.5. We simulate 10-year VIX
1
and SPX paths using a frequency of one day t =
252 with the average SPX implied volatility surface, and the SPX price on the 31st Dec 2021 as the starting point. The remaining
hyperparameters are as in the previous simulations. Figure 19 displays simulated sample
paths for the underlying and VIX. We note that the model (30)–(33) is able to produce high
VIX values as historically observed during the 2008 financial crisis and during the Covid19 pandemic. Figure 20 displayes simulated paths for one-month realized vol, one-month
ATM vol and VIX. We note that the VIX and the ATM vol are higher than the one-month
forward realized vol. The ATM vol is usually below the VIX in the simulations, which is
consistent with the post-pandemic dynamics (Figure 8).
We further investigate the relationship between the simulated values of VIX, ATM vol,
SPX, and the level process. Pearson correlation between the simulated log-increments of
SPX, ATM vol, VIX, and the increments of the level process is shown in Table 9. We note
that the log-returns of the underlying are negatively correlated with the increments of the