tmp_fix_full2/s11147-023-09195-5/assets/table_008.csv

Table 4,(continued),,,,,,,,
1 3 Volume,Maturity,Moneyness,,95% Quantile of abs. error,,,,Maximum absolute error,
,,,1d,3d,Spline,Spline*,1d,3d,Spline
High,Long,Center,0.0123,0.0300,0.0107,0.0090,2.7663,5.7096,3.6802
,,Left,0.0521,0.1640,0.0199,0.0172,3.4186,3.8177,6.1317
,,Right,0.0168,0.0908,0.0173,0.0162,3.3366,3.8574,10.7048
,Medium,Center,0.0096,0.0408,0.0085,0.0076,2.1903,17.1366,37465.8025
,,Left,0.0339,0.3653,0.0273,0.0236,3.5311,11.8155,21.8311
,,Right,0.0188,0.1825,0.0165,0.0162,3.4737,16.1318,1402341.6553
,Short,Center,0.0254,0.2359,0.0131,0.0115,1.7837,52.1571,15235.8668
,,Left,0.0510,0.7295,0.2763,0.2539,2.8282,35.9986,2.1062
,,Right,0.0457,0.4531,0.0359,0.0347,1.8318,51.4390,57586.5212
,(b) Interpolation only,,,,,,,,
Low,Long,Center,0.0226,0.0333,0.0147,0.0143,0.7004,3.3005,2.2983
,,Left,0.0524,0.1027,0.0167,0.0162,1.1605,3.1467,0.2746
,,Right,0.0232,0.0983,0.0365,0.0442,1.1689,3.5901,3.4783
,Medium,Center,0.0228,0.0542,0.0141,0.0111,1.6988,9.7269,12.6974
,,Left,0.0530,0.2788,0.8134,0.4260,1.8230,10.8440,1.0972
,,Right,0.0264,0.1808,0.0238,0.0222,1.7168,11.8739,11.0275
,Short,Center,0.0555,0.4700,0.0354,0.0343,1.6666,30.9378,12.7598

tmp_confidence_full/s11147-023-09195-5/paper.md

## Main Text

158
Fig. 5 (continued)
The average maximum absolute prediction error across all single stock options
shows that the one-dimensional kernel smoother outperforms the other two methods by several magnitudes. The maximum absolute implied volatility prediction
error for the one-dimensional kernel smoother ranges from 0.7004 to 2.7663,
1 3

162
▸
Fig. 6 Single stock (Bakshi et al., 2003) moments for different volatility surfaces. This figure displays
Boxplots of model-free option-implied (Bakshi et al., 2003) moments for the one-dimensional kernel
smoother method, the three-dimensional kernel smoother method and spline with N휏≥3 data points per
fitted line. The volume buckets stand for low, medium and high volume trading days. All options are of
short maturity with less than 30 days to expiration. The data covers the period from Jan 2004 to Jul 2019
while the respective values for the three-dimensional kernel smoother are 3.1467
to 52.1571 and 0.2746 to 109.5617 for the spline.
In summary, the one-dimensional kernel smoother is the most reliable method
for constructing single stock implied volatility surfaces. The three-dimensional
kernel smoother of OptionMetrics (2022) and the semi-parametric spline of
Figlewski (2008) are both prone to prediction errors with large second and higher
moments, suggesting that they may be too complex or unrealistic. We therefore recommend academics and practitioners to use the one-dimensional kernel
smoother for constructing end-of-day volatility surfaces.
5.5 Further implications for single stock option‑implied information
The extraction of meaningful economic insights from implied volatility surfaces
can be compromised by the presence of uninformative noise. This is particularly
relevant when evaluating the efficacy of option-implied risk measures. In this section, we investigate Bakshi et al. (2003)’s implied moments within the cross-section
of implied volatility. Additionally, we extend our analysis to replicate the skewness
spanning regressions presented in Bakshi et al. (2003) Table 6, utilizing an expanded
dataset that includes a larger number of firms and a longer time span compared to
Bakshi et al. (2003). Through these exercises, we aim to demonstrate the potential
effects that different methods for constructing volatility surfaces could have on the
extraction of information implied by options.
5.5.1 Impact of method selection on Bakshi et al. (2003) moments
Our analysis, as visualized in Fig. 6, underscores the importance of the methodology adopted for constructing the volatility surface. Both the three-dimensional kernel smoother and the spline method inject substantial uninformative noise, resulting in significant distortions in the Bakshi et al. (2003) moments. These distortions
are particularly acute for short-term options and in instances of extreme market
situations.
For short-term options across varying liquidity days, the distortions become even
more pronounced for options-implied skewness and kurtosis, with the three-dimensional kernel smoother drastically underpredicting kurtosis and depicting skewness close to zero. This infers that the implied risk-neutral density for this method
resembles a Gaussian distribution, a misleading interpretation when compared to the
1 3