tmp_fix_full2/s11147-023-09195-5/assets/table_009.csv

Table 4,(continued),,,,,,,,
Volume,Maturity,Moneyness,,95% Quantile of abs. error,,,,Maximum absolute error,
,,,1d,3d,Spline,Spline*,1d,3d,Spline
Medium,Long,Center,0.0145,0.0283,0.0079,0.0077,2.6279,4.3689,2.5927
,,Left,0.0271,0.1056,0.0095,0.0093,2.9184,3.9338,0.6134
,,Right,0.0138,0.0797,0.0132,0.0129,2.4878,3.8082,5.7743
,Medium,Center,0.0134,0.0403,0.0081,0.0079,2.0474,10.8848,23.5331
,,Left,0.0309,0.2874,0.0864,0.0825,2.0822,12.0208,1.5162
,,Right,0.0154,0.1688,0.0154,0.0154,1.9900,14.4632,23.7381
,Short,Center,0.0288,0.2614,0.0153,0.0145,1.7751,35.7643,18.0704
,,Left,0.0535,0.6600,0.2889,0.2380,1.4222,39.3441,0.6302
,,Right,0.0383,0.4234,0.0364,0.0351,1.6623,49.0625,62.9665
High,Long,Center,0.0120,0.0300,0.0065,0.0063,2.7663,5.7096,3.3716
,,Left,0.0242,0.1235,0.0071,0.0069,3.0287,3.8177,1.3670
,,Right,0.0114,0.0879,0.0129,0.0129,2.2399,3.8574,3.9594
,Medium,Center,0.0093,0.0405,0.0060,0.0060,1.9653,17.1366,9.3230
,,Left,0.0237,0.3057,0.0235,0.0230,2.5214,11.6185,1.1393
,,Right,0.0117,0.1693,0.0122,0.0124,2.4890,16.1318,13.3601
,Short,Center,0.0218,0.2225,0.0096,0.0093,1.5406,52.1571,109.5617
,,Left,0.0370,0.6297,0.2359,0.2322,1.4779,28.9173,0.6684

tmp_confidence_full/s11147-023-09195-5/paper.md

## Main Text

156
▸
Fig. 5 Boxplots for cross-validation squared prediction errors for single stock options, SplineN휏≥4 , by
industry sector. This figure displays Boxplots of the average cross-validation squared errors with inter- and
extrapolation across single stock options by GICS industry sector for the spline method. The maturity section categorizes options based on remaining maturities, with short maturity options having less than 30
days, medium maturity options having 30 to 365 days, and long maturity options having more than 365
days. The moneyness buckets, color-coded in the plot, are represented by m = K
F , and divides the volatility smile into left, center, and right sections, with the dividing lines at 0.95 and 1.05. The volume buckets
0.25, 0.5, 0.75 stand for low, medium and high volume trading days. The plot reports the results for spline
with N휏≥4 data points per fitted line. The data covers the period from Jan 2004 to Jul 2019
kernel smoother, while others have significantly larger errors. These industry-specific differences suggest that the semi-parametric spline method may not be reliable for single stock options analysis, particularly in certain industries. As such,
we advise caution when using the spline method and recommend that researchers
benchmark their results against those obtained using the one-dimensional kernel
smoother.
5.4 Lessons from the tails
To complete the analysis, we have a closer look at the (i) standard deviation of
the prediction error, (ii) the 95% quantile of the absolute prediction error and (iii)
the maximum absolute prediction error. These values are displayed in Table 4. As
previously, we aggregate prediction errors across all 499 firms and display results
for different volume/maturity/moneyness buckets.
The standard deviation of the prediction error, which can be viewed as the volatility of the distribution of prediction errors, is lower for the one-dimensional
kernel smoother than for the three-dimensional kernel smoother or spline. In
the high volume and short maturity options bucket, the prediction error volatility for the left-tail region is 0.0229, 0.3515, and 0.0999 for the one-dimensional
kernel smoother, three-dimensional kernel smoother, and spline, respectively.
The one-dimensional kernel smoother performs well regardless of which part
of the implied volatility surface is predicted, while the three-dimensional kernel
smoother and spline have difficulties predicting the tails. In summary, the realized
standard deviation of single stock implied volatility prediction errors is excessive
for all methods except the one-dimensional kernel smoother.
In terms of the 95% quantile of the absolute prediction error, the one-dimensional kernel smoother outperforms the other two methods, with respective values of 0.0370, 0.6297, and 0.2359 for high volume short maturity left-tail implied
volatilities. This implies that the worst 5% of mispricing for a short maturity
out-of-the-money put option is around 4% (implied volatility units) for the onedimensional kernel smoother, while it is 63% for the three-dimensional kernel
smoother of OptionMetrics (2022) and 24% for the spline. The three-dimensional
kernel smoother performs significantly worse on days when trading reveals more
information, while both the one-dimensional kernel smoother and spline tend to
exhibit lower 95% error quantiles as volume increases.
1 3

158
Fig. 5 (continued)
The average maximum absolute prediction error across all single stock options
shows that the one-dimensional kernel smoother outperforms the other two methods by several magnitudes. The maximum absolute implied volatility prediction
error for the one-dimensional kernel smoother ranges from 0.7004 to 2.7663,
1 3

162
▸
Fig. 6 Single stock (Bakshi et al., 2003) moments for different volatility surfaces. This figure displays
Boxplots of model-free option-implied (Bakshi et al., 2003) moments for the one-dimensional kernel
smoother method, the three-dimensional kernel smoother method and spline with N휏≥3 data points per
fitted line. The volume buckets stand for low, medium and high volume trading days. All options are of
short maturity with less than 30 days to expiration. The data covers the period from Jan 2004 to Jul 2019
while the respective values for the three-dimensional kernel smoother are 3.1467
to 52.1571 and 0.2746 to 109.5617 for the spline.
In summary, the one-dimensional kernel smoother is the most reliable method
for constructing single stock implied volatility surfaces. The three-dimensional
kernel smoother of OptionMetrics (2022) and the semi-parametric spline of
Figlewski (2008) are both prone to prediction errors with large second and higher
moments, suggesting that they may be too complex or unrealistic. We therefore recommend academics and practitioners to use the one-dimensional kernel
smoother for constructing end-of-day volatility surfaces.
5.5 Further implications for single stock option‑implied information
The extraction of meaningful economic insights from implied volatility surfaces
can be compromised by the presence of uninformative noise. This is particularly
relevant when evaluating the efficacy of option-implied risk measures. In this section, we investigate Bakshi et al. (2003)’s implied moments within the cross-section
of implied volatility. Additionally, we extend our analysis to replicate the skewness
spanning regressions presented in Bakshi et al. (2003) Table 6, utilizing an expanded
dataset that includes a larger number of firms and a longer time span compared to
Bakshi et al. (2003). Through these exercises, we aim to demonstrate the potential
effects that different methods for constructing volatility surfaces could have on the
extraction of information implied by options.
5.5.1 Impact of method selection on Bakshi et al. (2003) moments
Our analysis, as visualized in Fig. 6, underscores the importance of the methodology adopted for constructing the volatility surface. Both the three-dimensional kernel smoother and the spline method inject substantial uninformative noise, resulting in significant distortions in the Bakshi et al. (2003) moments. These distortions
are particularly acute for short-term options and in instances of extreme market
situations.
For short-term options across varying liquidity days, the distortions become even
more pronounced for options-implied skewness and kurtosis, with the three-dimensional kernel smoother drastically underpredicting kurtosis and depicting skewness close to zero. This infers that the implied risk-neutral density for this method
resembles a Gaussian distribution, a misleading interpretation when compared to the
1 3