tmp_quality_full/160101/assets/table_009.csv

,,,,,,,E(cid:9) ˆ(cid:29)(cid:1)t + 1(cid:2) ⊗ (cid:4)(cid:1)t(cid:2)(cid:11) = 0,,,,,E(cid:9) ˜(cid:29)(cid:1)t + 1(cid:2) ⊗ (cid:4)(cid:1)t(cid:2)(cid:11) = 0,,
,,Size,,,,,,,,,,,,
(cid:4)(cid:1)t(cid:2),,,,,(cid:15),,,,(cid:5),p,,,(cid:5),p
,,(days),df,,,,t((cid:15)),,T,,(cid:15)0,t((cid:15)0),T,
,Panel A: Risk-neutral OEX skews from 86-day options,,,,,,,,,,,,,
SET 1,,350,1,,2(cid:10)26,,2.11,,7(cid:10)60,0.005,12(cid:10)01,4.46,7.33,.006
,,400,1,,2(cid:10)08,,2.32,,4(cid:10)69,0.030,11(cid:10)20,2.93,4.87,.027
,,450,1,,1(cid:10)76,,2.48,,3(cid:10)77,0.052,9(cid:10)82,3.09,3.99,.045
SET 2,,350,2,,2(cid:10)29,,1.97,,10(cid:10)93,0.004,15(cid:10)99,2.66,8.86,.011
,,400,2,,2(cid:10)25,,2.22,,6(cid:10)96,0.030,12(cid:10)08,2.85,6.52,.038
,,450,2,,1(cid:10)99,,2.40,,4(cid:10)26,0.118,10(cid:10)85,3.01,4.52,.104
SET 3,,350,3,,11(cid:10)39,,2.67,,7(cid:10)01,0.071,22(cid:10)32,2.78,7.44,.059
,,400,3,,1(cid:10)76,,2.16,,11(cid:10)15,0.010,20(cid:10)23,2.95,6.17,.103
,,450,3,,1(cid:10)89,,2.35,,6(cid:10)70,0.082,11(cid:10)52,2.97,5.59,.133
,Panel B: Risk-neutral OEX skews from 58-day options,,,,,,,,,,,,,
SET 1,,350,1,,2(cid:10)09,,2.64,,13(cid:10)97,0.000,11(cid:10)95,3.63,8.90,.000
,,400,1,,1(cid:10)91,,2.80,,7(cid:10)81,0.005,9(cid:10)35,3.64,6.66,.009
,,450,1,,1(cid:10)36,,3.05,,8(cid:10)90,0.052,7(cid:10)25,3.99,7.77,.005
SET 2,,350,2,,3(cid:10)21,,2.60,,14(cid:10)63,0.000,16(cid:10)78,3.76,7.53,.023
,,400,2,,2(cid:10)12,,2.67,,14(cid:10)23,0.000,12(cid:10)29,3.67,8.56,.013
,,450,2,,1(cid:10)44,,2.93,,11(cid:10)20,0.003,8(cid:10)01,3.85,9.04,.010
SET 3,,350,3,,5(cid:10)98,,2.66,,9(cid:10)48,0.023,20(cid:10)87,3.90,5.66,.129
,,400,3,,2(cid:10)60,,2.60,,16(cid:10)95,0.000,16(cid:10)51,3.77,7.65,.053
,,450,3,,1(cid:10)59,,2.89,,11(cid:10)40,0.009,8(cid:10)84,3.78,8.75,.032
Consider,the,restrictions,,imposed,by,the,power,utility,pricing,kernel:,(cid:29)(cid:1)t + 1(cid:2) ≡ SKEWm(cid:1)t + 1(cid:2) − SKEWm(cid:1)t + 1(cid:2) +,,,
,"(cid:15)(cid:1)KURTm(cid:1)t + 1(cid:2) − 3(cid:2)STDm(cid:1)t + 1(cid:2), which is another way to express Equation (13) of Theorem 2. The risk aversion parameter,",,,,,,,,,,,,,
"(cid:15),",is estimated by generalized method of moments,,,,,,,(GMM).,,"In panels A and B, we report",,the GMM results when the risk-,,
,"neutral market skew, SKEWm,",,,,"is recovered from 86-day and 58-day options,",,,,,,respectively. Over,,the entire sample of January,
,1988 through December 1995 there are thus 32 (48) nonoverlapping observations for 86-,,,,,,,,,,,(58-) day options. We build the time,,
,series of higher-order physical,,,,"return moments, STD, SKEW, and KURT,",,,,,,from daily returns on the OEX. Thus a sample size,,,
,(denoted Size) of 350 days means that we go backward 350 days to construct,,,,,,,,,,"the moments. For consistency, each variable has",,,
,"been annualized. The degrees of freedom, df, are the number of instruments, (cid:4)(cid:1)t(cid:2), minus one. In SET 1,",,,,,,,,,,,,the instrumental vari-,
,"ables are a constant plus SKEWm(cid:1)t(cid:2). Likewise, SET 2 (SET 3), contains SET 1 (SET 2) plus SKEWm(cid:1)t −1(cid:2) (SKEWm(cid:1)t −2(cid:2)).",,,,,,,,,,,,,
For,"robustness, other",,information sets were tried;,,,,,they yielded similar,,,implications. The minimized value (multiplied by T ) of,,,
"the GMM criterion function, (cid:5)T ,",,,,,is chi-square distributed with df. The impact of physical skews on risk-neutral skews is studied,,,,,,,,,
,by considering the ad hoc speciﬁcation ˜(cid:29)(cid:1)t + 1(cid:2) ≡ SKEWm(cid:1)t + 1(cid:2) − (cid:15)0SKEWm(cid:1)t + 1(cid:2).,,,,,,,,,,,,,
134,,,,,,,,,,,,,,

tmp_fix_full/160101/paper.md

### Stock Return Characteristics, Skew Laws,

Table 6
The character of individual and index risk-neutral skewness
Sign of
Univariate regression
skewness
SKEWnt = 0 +1SKEWmt+ t
Price of moments
SKEWn >
SKEWn
√
R2
0
t0
1
t1
V
SKEW
KURT
< 0
Ticker
SKEWm
−0 21
0 11
1 43
0 29
4 46
7 2
7 98
1. AIG
68
96
2.20
−0 54
−3 77
−0 65
0 11
0 85
0 3
6 59
2. AIT
83
77
4.18
−0 38
0 35
1 79
0 67
3 92
5 9
6 59
3. AN
69
84
5.00
−0 08
−0 50
−0 12
0 04
0 28
0 0
10 93
4. AXP
48
90
4.51
−0 14
0 17
1 65
0 29
3 21
3 8
9 16
5. BA
58
94
4.54
−0 44
0 13
1 13
0 52
5 29
9 9
10 48
6. BAC
77
88
3.99
−0 89
−4 86
−0 21
−1 28
−0 68
0 7
7 09
7. BEL
79
72
5.62
−0 46
0 22
1 73
0 63
5 68
11 1
7 42
8. BMY
74
86
4.46
−0 01
−0 06
−0 28
0 25
2 98
3 3
12 71
9. CCI
69
92
3.88
−0 00
−0 04
−0 26
0 24
2 77
2 9
8 39
10. DD
69
92
3.87
−0 09
−1 28
−0 13
0 04
0 61
0 2
10 17
11. DIS
62
98
3.18
−0 13
0 05
0 39
0 16
1 55
0 9
11 02
12. F
58
93
3.98
−0 08
−0 97
−0 53
0 41
5 37
10 0
7 60
13. GE
88
87
3.90
−0 01
−0 15
−0 09
0 07
1 00
0 4
11 07
14. GM
56
95
3.53
−0 17
0 18
2 48
0 32
5 06
9 0
11 85
15. HWP
61
96
2.33
0 27
3 92
0 20
3 47
4 5
10 49
0 04
16. IBM
43
98
2.89
−0 30
0 28
2 36
0 52
5 20
9 6
8 49
17. JNJ
65
91
4.12
−0 21
−1 93
−0 56
0 32
3 44
4 4
8 27
18. KO
87
82
4.48
−0 34
−2 22
−0 41
0 07
0 51
0 1
8 51
19. MCD
71
85
5.18
−0 09
−0 81
−0 15
0 05
0 48
0 1
12 18
20. MCQ
53
91
3.78
−0 36
0 03
0 40
0 36
5 55
10 7
7 27
21. MMM
85
95
3.28
−0 15
−1 43
−0 39
0 22
2 54
2 4
6 47
22. MOB
77
88
3.47
−0 43
−2 65
−0 24
−1 76
−0 16
1 2
9 38
23. MRK
51
86
4.41
−0 04
0 16
1 07
0 18
1 40
0 8
10 44
24. NT
37
93
4.03
−0 04
−0 26
−0 39
0 33
2 78
2 9
8 67
25. PEP
72
87
5.87
−0 07
0 13
1 11
0 19
1 82
1 3
8 74
26. SLB
50
94
3.09
−0 76
−4 75
−0 14
−1 01
−0 61
0 4
7 28
27. T
78
76
6.10
−0 38
0 20
1 53
0 53
4 78
8 2
10 34
28. WMT
70
88
4.18
−0 25
−1 42
−0 58
0 31
2 07
1 6
5 93
29. XON
83
82
5.49
−0 09
−1 19
−0 33
0 22
3 40
4 3
9 27
30. XRX
77
93
2.50
−1 09
5 56
31. OEX
100
3.99
For each of the 30 stocks and the S&P 100, the table reports three sets of numbers relating to the weekly risk-neutral moments
estimated. In the ﬁrst two columns, we report (i) the percentage of observations for which SKEWn < 0, and (ii) the percentage
of observations for which the risk-neutral skewness of the stock, SKEWn, is more than the risk-neutral skewness of the market,
SKEWm (i.e., less negative than the risk-neutral index skewness). The next ﬁve columns present the results of an OLS regression:
SKEWnt = 0 +1SKEWmt+ t, where 0, 1 are the intercept and sensitivity coefﬁcients, respectively; t0t1
are the t-statistics, and R2 is the coefﬁcient of determination (in percent). The last three columns display the average estimate
of the risk-neutral volatility, skew, and kurtosis (with one exception, all moments are statistically signiﬁcant and omitted). The
volatility is the square root of the variance contract, reported in percent. All moments used are of short-term maturity. The
sample period is January 1, 1991, to December 31, 1995.
(that is, SKEWn < 0). Together these statistics again highlight the dichotomy
between the market index and the individual stocks. Unlike any individual stock return distribution, the OEX risk-neutral distribution is persistently
skewed to the left in each of the 260 weeks in the sample. Finally, on average across the 30 stocks, the individual skew is less negative than the market
89% of the time. Only occasionally do individual stocks have skews that are
more negative than the OEX (13% and 2% for GE and IBM, respectively).
How do we interpret the fact that individual skews are almost always less
negative than that of the market index? In light of the underlying theory,
there are at least three explanations. First, if there is indeed a market component in the individual return, then our characterizations indicate that the
131

As our intent is to estimate a single coefﬁcient, , and test the restrictions
embedded within Equation (37), the GMM appears to be an attractive estimation method for several reasons. First, unlike return volatility, the estimates
of physical skews and kurtosis require a fairly long time series and will be
measured with error [Merton (1980) and Harvey and Siddique (2000)]. Therefore the market skew formulation of Equation (37) is susceptible to an errors
in variables problem. Second, the return standard deviation and the excess
kurtosis enter nonlinearly in Equation (37) and may be correlated with ˆ .
Finally, the minimized GMM criterion function (multiplied by T ), T , offers
a convenient approach to assess misspeciﬁcations in Equation (37). The T
statistic is chi-square distributed with L −1 degrees of freedom (given L
instruments).
Before turning to a discussion of GMM estimation results reported in
panels A and B of Table 7, some clariﬁcations are in order. First, Theorem 2
applies for a particular . We therefore generate a nonoverlapping series of
risk-neutral index skews from options with maturities of 58 and 86 days.
Second, estimates of physical skews and kurtosis are sensitive to the choice
Table 7
GMM tests of the market skew equation
E ˆ t +1⊗t = 0
E ˜ t +1⊗t = 0
Size
T
t
T
p
0
t(0)
p

t()
(days)
df
Panel A: Risk-neutral OEX skews from 86-day options
2 26
7 60
12 01
SET 1
350
1
2.11
0.005
4.46
7.33
.006
2 08
4 69
11 20
400
1
2.32
0.030
2.93
4.87
.027
1 76
3 77
9 82
450
1
2.48
0.052
3.09
3.99
.045
2 29
10 93
15 99
SET 2
350
2
1.97
0.004
2.66
8.86
.011
2 25
6 96
12 08
400
2
2.22
0.030
2.85
6.52
.038
1 99
4 26
10 85
450
2
2.40
0.118
3.01
4.52
.104
11 39
7 01
22 32
SET 3
350
3
2.67
0.071
2.78
7.44
.059
1 76
11 15
20 23
400
3
2.16
0.010
2.95
6.17
.103
1 89
6 70
11 52
450
3
2.35
0.082
2.97
5.59
.133
Panel B: Risk-neutral OEX skews from 58-day options
2 09
13 97
11 95
SET 1
350
1
2.64
0.000
3.63
8.90
.000
1 91
7 81
9 35
400
1
2.80
0.005
3.64
6.66
.009
1 36
8 90
7 25
450
1
3.05
0.052
3.99
7.77
.005
3 21
14 63
16 78
SET 2
350
2
2.60
0.000
3.76
7.53
.023
2 12
14 23
12 29
400
2
2.67
0.000
3.67
8.56
.013
1 44
11 20
8 01
450
2
2.93
0.003
3.85
9.04
.010
5 98
9 48
20 87
SET 3
350
3
2.66
0.023
3.90
5.66
.129
2 60
16 95
16 51
400
3
2.60
0.000
3.77
7.65
.053
1 59
11 40
8 84
450
3
2.89
0.009
3.78
8.75
.032
Consider the restrictions imposed by the power utility pricing kernel: ˆ t + 1 ≡SKEWmt + 1 −SKEWmt + 1 +
KURTmt +1−3STDmt +1, which is another way to express Equation (13) of Theorem 2. The risk aversion parameter,
, is estimated by generalized method of moments (GMM). In panels A and B, we report the GMM results when the riskneutral market skew, SKEWm, is recovered from 86-day and 58-day options, respectively. Over the entire sample of January
1988 through December 1995 there are thus 32 (48) nonoverlapping observations for 86- (58-) day options. We build the time
series of higher-order physical return moments, STD, SKEW, and KURT, from daily returns on the OEX. Thus a sample size
(denoted Size) of 350 days means that we go backward 350 days to construct the moments. For consistency, each variable has
been annualized. The degrees of freedom, df, are the number of instruments, t, minus one. In SET 1, the instrumental variables are a constant plus SKEWmt. Likewise, SET 2 (SET 3), contains SET 1 (SET 2) plus SKEWmt−1 (SKEWmt−2).
For robustness, other information sets were tried; they yielded similar implications. The minimized value (multiplied by T ) of
the GMM criterion function, T , is chi-square distributed with df. The impact of physical skews on risk-neutral skews is studied
by considering the ad hoc speciﬁcation ˜ t +1 ≡SKEWmt +1−0SKEWmt +1.
134