tmp_fix_full2/arbitrage-free-neural-sde-market-models/assets/table_001.csv

Factors,MAPE,PDA,PSAS
Dynamic arb.,24.37%,3.51%,60.67%
Dynamic arb. + Statistical acc.,5.11%,3.21%,28.11%
Dynamic arb. + Static arb.,3.85%,3.04%,0.37%
Figure 9. Price basis functions of the normalized call price surface.,,,
Figure 10. Trajectory (black dots) of the R2 factors and the corresponding static arbitrage constraints,,,
(red dashed lines) projected to the R2 factor space.,,,

tmp_confidence_full2/arbitrage-free-neural-sde-market-models/paper.md

### Applied Mathematical Finance

27
Table 2. MAPE, PDA and PSAS metrics when including diﬀerent
combinations of factors.
Factors
MAPE
PDA
PSAS
Dynamic arb.
24.37%
3.51%
60.67%
Dynamic arb. + Statistical acc.
5.11%
3.21%
28.11%
Dynamic arb. + Static arb.
3.85%
3.04%
0.37%
Figure 9. Price basis functions of the normalized call price surface.
Figure 10. Trajectory (black dots) of the R2 factors and the corresponding static arbitrage constraints
(red dashed lines) projected to the R2 factor space.
G0 is obtained by interpolating the normalized call prices averaged over time. Since the
minimal option expiry in the input data is nonzero, there is no guarantee that the terminal payoff convergence condition (5) will be satisfied by simply extrapolating the input
data along expiry. Hence, we introduce a few artificial data points at τ = 0 for Gi, where
i=0,1,2, that satisfy (5) before interpolation.
Given these factors, we use the linear programming method (Caron, McDonald, and
Ponic 1989) to eliminate redundant constraints in the system AG⊤ξ ≥b, which is the projection of the original no-arbitrage constraints, constructed in price space, to the R2 factor
space. This results in only 7 constraints, which we indicate as red dashed lines in Figure 10.
The convex polygonal domain surrounded by these constraints (light green area) is the
statically arbitrage-free zone for the factors, that is, provided the factor process remains in
this region, we are guaranteed to have no static arbitrage in the reconstructed call prices
on our liquid lattice Llip.